{"creator_review":{"source":null,"status":"pending"},"experiment_sha256":"d47dc50371da90ec27270ea836e0fc3114cde0e80a755ae08a35e755ebdcba54","gates":{"cadence":{"measured":null,"passed":true},"control_configuration":{"measured":null,"passed":true},"control_frame_invariance":{"measured":null,"passed":true},"control_schedule":{"measured":null,"passed":true},"control_state_invariance":{"measured":null,"passed":true},"e0":{"measured":null,"passed":true},"excitation":{"measured":0.1318699623083424,"passed":true},"finite_fields":{"measured":null,"passed":true},"finite_states":{"measured":null,"passed":true},"frame_schedule":{"measured":null,"passed":true},"image_recovery":{"measured":null,"passed":true},"morphology":{"measured":0.8835464146748193,"passed":true},"nominal_settings":{"measured":null,"passed":true},"numeric_recovery":{"measured":{"first_tick":330,"last_tick":360,"position_max":1.1262011838891746e-05,"speed_max":3.4149626392197566e-05},"passed":true},"provisional_baseline":{"measured":null,"passed":true},"replay":{"measured":null,"passed":true},"state_bounds":{"measured":null,"passed":true},"state_schedule":{"measured":null,"passed":true},"temporal_variation":{"measured":101,"passed":true},"tests":{"measured":null,"passed":true},"visibility":{"measured":null,"passed":true}},"passed":true,"schema_version":"cz-profile-0.3"}
